,Cocktail Name,Cocktail_tags,Ingredients,Preparation,Alcoholic?,Category
0,155 Belmont,,"1 shot Orange juice, 1 shot Vodka, 2 shots Light rum, 1 shot Dark rum, ",Blend with ice. Serve in a wine glass. Garnish with carrot.,Alcoholic,Cocktail
1,1-900-FUK-MEUP,,"1/4 oz Pineapple juice, 1/2 oz Cranberry juice, 1/4 oz Amaretto, 1/4 oz Malibu rum, 1/4 oz Midori melon liqueur, 1/4 oz Chambord raspberry liqueur, 1/4 oz Grand Marnier, 1/2 oz Absolut Kurant, ",Shake ingredients in a mixing tin filled with ice cubes. Strain into a rocks glass.,Alcoholic,Shot
2,110 in the shade,,"1.5 oz Tequila, 16 oz Lager, ",Drop shooter in glass. Fill with beer,Alcoholic,Beer
3,151 Florida Bushwacker,,"1 cup Vanilla ice-cream, 1 oz Coconut liqueur, 3 oz Milk, 1 oz Cointreau, 1 oz Dark Creme de Cacao, 1/2 oz Bacardi 151 proof rum, 1/2 oz Light rum, 1/2 oz Malibu rum, ",Combine all ingredients. Blend until smooth. Garnish with chocolate shavings if desired.,Alcoholic,Shake
4,252,,"1/2 shot Wild Turkey, 1/2 shot Bacardi 151 proof rum, ","Add both ingredients to shot glass, shoot, and get drunk quick",Alcoholic,Shot
5,24k nightmare,,"1/2 oz Bacardi 151 proof rum, 1/2 oz Rumple Minze, 1/2 oz Jägermeister, 1/2 oz Goldschlager, ","Add over ice,shake and pour.",Alcoholic,Shot
6,3 Wise Men,,"1/3 oz Jim Beam, 1/3 oz Johnnie Walker, 1/3 oz Jack Daniels, ",put them them in a glass... and slam it to tha head.,Alcoholic,Shot
7,3-Mile Long Island Iced Tea,,"Garnish withLemon, 1 wedge Bitters, 1-2 dash Sweet and sour, 1/2 ozCoca-Cola, 1/2 ozVodka, 1/2 ozTriple sec, 1/2 ozTequila, 1/2 ozLight rum, 1/2 ozGin, ",Fill 14oz glass with ice and alcohol. Fill 2/3 glass with cola and remainder with sweet & sour. Top with dash of bitters and lemon wedge.,Alcoholic,Ordinary Drink
8,410 Gone,,"NoneCoca-Cola, 2-3 ozPeach Vodka, ",,Alcoholic,Ordinary Drink
9,50/50,,"Fill with Orange juice, 1 splash Grand Marnier, 2 1/2 oz Vanilla vodka, ",fill glass with crushed ice. Add vodka. Add a splash of grand-marnier. Fill with o.j.,Alcoholic,Ordinary Drink
10,501 Blue,,"None7-Up, NoneSour mix, NoneVodka, NoneBlueberry schnapps, NoneBlue Curacao, ",Mix equal amounts into a glass with ice.,Alcoholic,Ordinary Drink
11,57 Chevy with a White License Plate,,"1 oz Vodka, 1 oz white Creme de Cacao, ",1. Fill a rocks glass with ice 2.add white creme de cacao and vodka 3.stir,Alcoholic,Cocktail
12,69 Special,,"0.75 oz Lemon juice, 4 oz 7-Up, 2 oz dry Gin, ","Pour 2 oz. gin. Add 4 oz. 7-up. Add Lemon Juice for flavor. If you are weak, top up glass with more 7-Up.",Alcoholic,Ordinary Drink
13,747,,"1/3 part Frangelico, 1/3 part Baileys irish cream, 1/3 part Kahlua, ","pour kaluha, then Baileys, then Frangelico not chilled and not layered -- SERVE!!!",Alcoholic,Shot
14,747 Drink,,"TopSprite, 1 ozCranberry Juice, 1 ozRoses sweetened lime juice, 1 ozVodka, ","Fill a Collins glass with ice.
Pour in vodka, lime cordial, and cranberry juice.
Fill up with Sprite.
Garnish with a Lime wheel or some cranberries",Alcoholic,Cocktail
15,9 1/2 Weeks,,"1 oz Orange juice, 1 splash Strawberry liqueur, 1/2 oz Orange Curacao, 2 oz Absolut Citron, ",Combine all ingredients in glass mixer. Chill and strain into Cocktail glass. Garnish with sliced strawberry.,Alcoholic,Cocktail
16,A1,,"1/8 ShotGrenadine, 1/4 ShotLemon Juice, 1 Shot Grand Marnier, 1 3/4 shot Gin, ","Pour all ingredients into a cocktail shaker, mix and serve over ice into a chilled glass.",Alcoholic,Cocktail
17,ABC,,"1/3 Cognac, 1/3 Baileys irish cream, 1/3 Amaretto, ",Layered in a shot glass.,Alcoholic,Shot
18,Ace,,"1/2 FreshEgg White, 1/2 shotMilk, 1/2 shot Heavy cream, 1/2 shot Grenadine, 2 shots Gin, ",Shake all the ingredients in a cocktail shaker and ice then strain in a cold glass.,Alcoholic,Cocktail
19,ACID,,"1 oz Wild Turkey, 1 oz Bacardi 151 proof rum, ",Poor in the 151 first followed by the 101 served with a Coke or Dr Pepper chaser.,Alcoholic,Shot
20,Adam,"Alcoholic,Holiday","1 tsp Grenadine, 1 oz Lemon juice, 2 oz Dark rum, ","In a shaker half-filled with ice cubes, combine all of the ingredients. Shake well. Strain into a cocktail glass.",Alcoholic,Ordinary Drink
21,AT&T,,"4 oz Tonic water, 1 oz Gin, 1 oz Absolut Vodka, ","Pour Vodka and Gin over ice, add Tonic and Stir",Alcoholic,Ordinary Drink
22,A. J.,,"1 oz Grapefruit juice, 1 1/2 oz Applejack, ","Shake ingredients with ice, strain into a cocktail glass, and serve.",Alcoholic,Ordinary Drink
23,Affair,,"NoneClub soda, 2 oz Cranberry juice, 2 oz Orange juice, 2 oz Strawberry schnapps, ","Pour schnapps, orange juice, and cranberry juice over ice in a highball glass. Top with club soda and serve.",Alcoholic,Ordinary Drink
24,Apello,,"1 Maraschino cherry, 1 cl Apple juice, 3 cl Grapefruit juice, 4 cl Orange juice, ",Stirr. Grnish with maraschino cherry.,Non alcoholic,Other / Unknown
25,Avalon,,"NoneLemonade, 1 1/2 part Lemon juice, 6 parts Apple juice, 1 part Pisang Ambon, 3 partsVodka, ","Fill a tall glass with ice. Layer the Finlandia Vodka, lemon and apple juices, Pisang Ambon, and top up with lemonade. Stir slightly and garnish with a spiralled cucumber skin and a red cherry. The cucumber provides zest and looks attractive. This drink, created by Timo Haimi, took first prize in the 1991 Finlandia Vodka Long Drink Competition.",Alcoholic,Ordinary Drink
26,Abilene,,"3 oz Orange juice, 2 oz Peach nectar, 1 1/2 oz Dark rum, ",Pour all of the ingredients into a highball glass almost filled with ice cubes. Stir well.,Alcoholic,Ordinary Drink
27,Addison,,"1 1/2 shot Vermouth, 1 1/2 shot Gin, ",Shake together all the ingredients and strain into a cold glass.,Alcoholic,Cocktail
28,Almeria,,"1 Egg white, 1 oz Kahlua, 2 oz Dark rum, ","In a shaker half-filled with ice cubes, combine all of the ingredients. Shake well. Strain into a cocktail glass.",Alcoholic,Ordinary Drink
29,Acapulco,,"1 Mint, 1 Egg white, 1 tsp Sugar, 1 tblsp Lime juice, 1 1/2 tsp Triple sec, 1 1/2 oz Light rum, ",Combine and shake all ingredients (except mint) with ice and strain into an old-fashioned glass over ice cubes. Add the sprig of mint and serve.,Alcoholic,Ordinary Drink
30,Affinity,,"2 dashes Orange bitters, 1 oz Dry Vermouth, 1 oz Sweet Vermouth, 1 1/2 oz Scotch, ","In a mixing glass half-filled with ice cubes, combine all of the ingredients. Stir well. Strain into a cocktail glass.",Alcoholic,Ordinary Drink
31,Applecar,,"1 oz Lemon juice, 1 oz Triple sec, 1 oz Applejack, ","Shake all ingredients with ice, strain into a cocktail glass, and serve.",Alcoholic,Ordinary Drink
32,Aviation,"IBA,Classic","1.5 clmaraschino liqueur, 1.5 cllemon juice, 4.5 clGin, ",Add all ingredients into cocktail shaker filled with ice. Shake well and strain into cocktail glass. Garnish with a cherry.,Alcoholic,Cocktail
33,Adam Bomb,,"NoneFruit juice, 1-3 pint Salt, NoneIce, NoneFruit, 1/2 part Triple sec, 1 part Tequila, 1 part Vodka, 1 part Rum, ","Add ice to blender (or to glass if prefer on the rocks) then fruit, and fruite juice depending on personal prefference then add the Rum, Vodka, Tequila, and triple sec. blend till smooth, rim glass with sugar or salt and pour mixture in. garnish with lemon or lime slice.",Alcoholic,Punch / Party Drink
34,Addington,,"Top up with
Soda Water, 1 shot Dry Vermouth, 2 shots Sweet Vermouth, ",Mix both the vermouth's in a shaker and strain into a cold glass. Top up with a squirt of Soda Water. ,Alcoholic,Cocktail
35,After sex,,"NoneOrange juice, 1 cl Creme de Banane, 2 cl Vodka, ",Pour the vodka and creme over some ice cubes in a tall glass and fill up with juice. to make it beuty full make the top of the glass with a grenadine and sugar,Alcoholic,Ordinary Drink
36,Afterglow,,"4 parts Pineapple juice, 4 parts Orange juice, 1 part Grenadine, ",Mix. Serve over ice.,Non alcoholic,Cocktail
37,Afternoon,,"NoneCream, 4 cl hot Coffee, 1 1/2 Frangelico, 1 cl Baileys irish cream, 1 cl Kahlua, ","Build into a suiting glass, with no ice. Cream on top if wanted. Served directly.",Alcoholic,Coffee / Tea
38,Alexander,"IBA,Classic,Dairy","NoneNutmeg, 2 oz Light cream, 1/2 oz white Creme de Cacao, 1/2 oz Gin, ",Shake all ingredients with ice and strain contents into a cocktail glass. Sprinkle nutmeg on top and serve.,Alcoholic,Ordinary Drink
39,Algonquin,,"1 oz Pineapple juice, 1 oz Dry Vermouth, 1 1/2 oz Blended whiskey, ","Combine and shake all ingredients with ice, strain contents into a cocktail glass, and serve.",Alcoholic,Ordinary Drink
40,Allegheny,,"1 twist of Lemon peel, 1 1/2 tsp Lemon juice, 1 1/2 tsp Blackberry brandy, 1 oz Bourbon, 1 oz Dry Vermouth, ",Shake all ingredients (except lemon peel) with ice and strain into a cocktail glass. Top with the twist of lemon peel and serve.,Alcoholic,Ordinary Drink
41,B-52,"IBA,NewEra","1/4 Kahlua, 1/3 Grand Marnier, 1/3 Baileys irish cream, ",Layer ingredients into a shot glass. Serve with a stirrer.,Alcoholic,Shot
42,B-53,,"1/3 shot Grand Marnier, 1/3 shot Sambuca, 1/3 shot Kahlua, ","Layer the Kahlua, Sambucca and Grand Marnier into a shot glas in that order. Better than B-52",Alcoholic,Shot
43,Bijou,,"1 ozSweet Vermouth, 1 ozGin, 1 ozGreen Chartreuse, 1 dashOrange Bitters, ","Stir in mixing glass with ice and strain
",Alcoholic,Cocktail
44,Boxcar,,"1 Egg white, 1/2 tsp Grenadine, 1 tsp Lemon juice, 1 oz Triple sec, 1 1/2 oz Gin, ","In a shaker half-filled with ice cubes, combine all of the ingredients. Shake well. Strain into a sour glass.",Alcoholic,Ordinary Drink
45,Big Red,,"1/2 oz Goldschlager, 1/2 oz Irish cream, ",Pour ingredients into 1 ounce shot glass,Alcoholic,Shot
46,Bellini,"ContemporaryClassic,IBA","1 oz Peach schnapps, 6 oz Champagne, ","Pour peach purée into chilled flute, add sparkling wine. Stir gently.",Alcoholic,Ordinary Drink
47,Bramble,"IBA,NewEra","1.5 clCreme de Mure, 1 clSugar syrup, 1.5 cllemon juice, 4 clGin, ","Fill glass with crushed ice. Build gin, lemon juice and simple syrup over. Stir, and then pour blackberry liqueur over in a circular fashion to create marbling effect. Garnish with two blackberries and lemon slice.",Alcoholic,Ordinary Drink
48,Balmoral,,"2 dashes Bitters, 1/2 oz Dry Vermouth, 1/2 oz Sweet Vermouth, 1 1/2 oz Scotch, ","In a mixing glass half-filled with ice cubes, combine all of the ingredients. Stir well. Strain into a cocktail glass.",Alcoholic,Ordinary Drink
49,Bluebird,,"1 twist of Lemon peel, 1 Maraschino cherry, 2 dashes Bitters, 1/2 oz Blue Curacao, 1/2 oz Triple sec, 1 1/2 oz Gin, ","In a mixing glass half-filled with crushed ice, combine the gin, triple sec, Curacao, and bitters. Stir well. Strain into a cocktail glass and garnish with the lemon twist and the cherry.",Alcoholic,Ordinary Drink
50,Brooklyn,"Alcoholic,Sweet,DateNight,USA","1Maraschino Cherry, 3 dashesAngostura Bitters, 1/4 ozMaraschino Liqueur, 1 ozDry Vermouth, 2 ozRye Whiskey, ",Combine ingredients with ice and stir until well-chilled. Strain into a chilled cocktail glass.,Alcoholic,Cocktail
51,Bora Bora,,"1 cl Grenadine, 1 cl Lemon juice, 6 cl Passion fruit juice, 10 cl Pineapple juice, ","Prepare in a blender or shaker, serve in a highball glass on the rocks. Garnish with 1 slice of pineapple and one cherry.",Non alcoholic,Cocktail
52,Boomerang,,"1 Maraschino cherry, 1/2 tsp Maraschino liqueur, 2 dashes Bitters, 1/2 oz Dry Vermouth, 2 oz Gin, ","In a mixing glass half-filled with ice cubes, combine the gin, vermouth, bitters, and maraschino liqueur. Stir well. Strain into a cocktail glass and garnish with the cherry.",Alcoholic,Ordinary Drink
53,Barracuda,"IBA,NewEra","top up Prosecco,  1 dashLime Juice, 6 clPineapple Juice, 1.5 clGalliano, 4.5 clRum, ","Shake pour ingredients with ice. Strain into glass, top with Sparkling wine.",Alcoholic,Ordinary Drink
54,Brigadier,,"1 ozCherry Heering, 1 ozGreen Chartreuse, 4 ozHot Chocolate, ",Mix ingredients in a warmed mug and stir.,Alcoholic,Cocktail
55,Broadside,,"cubesIce, 1 FreshWormwood, 3 dropsBitters, 1/2 shotScotch, 1 shot151 proof rum, ","Half fill the glass with ice cubes. Crush the wormwood and add to ice. Pour rum, scotch and butters, then serve!",Alcoholic,Cocktail
56,Buccaneer,,"1 shot Bacardi Limon, 1 Corona, ",Pour the corona into an 18oz beer glass pour the bacardi limon into the beer stir very gently,Alcoholic,Beer
57,Brain Fart,,"1 pint Rum, 1 small bottle Lemon juice, 2 L Surge, 2 L Mountain Dew, 1 fifth Smirnoff red label Vodka, 1 fifth Everclear, ",Mix all ingredients together. Slowly and gently. Works best if ice is added to punch bowl and soda's are very cold.,Alcoholic,Punch / Party Drink
58,Blackthorn,,"1 twist of Lemon peel, 1 1/2 oz Sloe gin, 1 oz Sweet Vermouth, ",Stir sloe gin and vermouth with ice and strain into a cocktail glass. Add the twist of lemon peel and serve.,Alcoholic,Ordinary Drink
59,Bob Marley,,"1/2 oz Goldschlager, 1/2 oz Jägermeister, 1/2 oz Midori melon liqueur, ",Layer in a 2 oz shot glass or pony glass,Alcoholic,Shot
60,Bible Belt,,"2 oz Sour mix, 2 wedges Lime, 1/2 oz Triple sec, 2 oz Southern Comfort, ","Mix all ingredients, and pour over ice.",Alcoholic,Other / Unknown
61,Bubble Gum,,"1/4 Peach schnapps, 1/4 Orange juice, 1/4 Banana liqueur, 1/4 Vodka, ",Layer in order into a shot glass.,Alcoholic,Shot
62,Bumble Bee,,"1/3 oz Sambuca, 1/3 oz Kahlua, 1/3 oz Baileys irish cream, ","This is a layered shot. First pour the Bailey's into the shot glass. Then take an upside down spoon and touch it to the inside wall of the glass. Carefully add the Kahlua. Repeat this process for the Sambuca. If done properly, the alcohol will stay separated and resemble a bumble bee. Enjoy!!!",Alcoholic,Shot
63,Baby Eskimo,,"2 scoops Vanilla ice-cream, 8 oz Milk, 2 oz Kahlua, ","Leave ice-cream out for about 10 minutes. Add ingredients in order, stir with chopstick (butter knife or spoon works too). Consume immediately and often. Nice and light, great for following a heavy drink.",Alcoholic,Shake
64,Boston Sour,,"1 Cherry, 1 slice Lemon, 1 Egg white, 1 tsp Powdered sugar, Juice of 1/2 Lemon, 2 oz Blended whiskey, ","Shake juice of lemon, powdered sugar, blended whiskey, and egg white with cracked ice and strain into a whiskey sour glass. Add the slice of lemon, top with the cherry, and serve.",Alcoholic,Ordinary Drink
65,Bahama Mama,,"1 partSweet and Sour, 2 partsOrange Juice, 2 partsPineapple Juice, 1 partGrenadine, 1 partBanana liqueur, 1 partDark Rum, 3 partsRum, ","Add 2 parts club soda or more or less to taste.

Mix it all together and pour over a bunch of ice. Drink with a straw.",Alcoholic,Cocktail
66,Casino,IBA,"1 Cherry, 2 dashes Orange bitters, 1/4 tsp Lemon juice, 1/4 tsp Maraschino liqueur, 2 oz Gin, ",Pour all ingredients into shaker with ice cubes. Shake well. Strain into chilled cocktail glass. Garnish with a lemon twist and a maraschino cherry. Serve without a straw.,Alcoholic,Ordinary Drink
67,Cafe Savoy,,"NoneBrandy, 1/2 oz Triple sec, 1/2 oz Milk, NoneCoffee, ","Fill mug almost to top with coffee.Add milk, triple sec and brandy. Stir.",Alcoholic,Coffee / Tea
68,Caipirinha,"ContemporaryClassic,IBA","2 1/2 oz Cachaca, 1 Lime, 2 tspSugar, ",Place lime and sugar into old fashioned glass and muddle (mash the two ingredients together using a muddler or a wooden spoon). Fill the glass with ice and add the Cachaça.,Alcoholic,Ordinary Drink
69,Cream Soda,,"NoneGinger ale, 1 oz Spiced rum, ",Pour 1oz of Spiced Rum into a highball glass with ice. Fill with Ginger Ale.,Alcoholic,Cocktail
70,Cuba Libra,,"NoneIce, Fill with Coca-Cola, Squeeze Lime, 1-2 shot Dark rum, ",Fill tall glass with ice cubes. Add rum. Rub cut edge of lime on rim of glass then squeeze juice into glass. Fill with Coca-Cola. Garnish with lime slice. Enjoy!,Alcoholic,Ordinary Drink
71,Cherry Rum,,"1 tblsp Light cream, 1 1/2 tsp Cherry brandy, 1 1/4 oz Light rum, ","Shake all ingredients with ice, strain into a cocktail glass, and serve.",Alcoholic,Ordinary Drink
72,Cuba Libre,"IBA,ContemporaryClassic","NoneCoca-Cola, Juice of 1/2 Lime, 2 oz Light rum, ",Build all ingredients in a Collins glass filled with ice. Garnish with lime wedge.,Alcoholic,Ordinary Drink
73,Corn n Oil,,"1 ozblackstrap rum, 1 ozAñejo rum, 2 dashesAngostura Bitters, 1/3 ozFalernum, 1/2Lime, ","Cut the half lime in half again. Add the lime, falernum, and bitters to a rocks glass. Muddle. Add the rum. (Aged Barbados rum such as Plantation 5 Year is recommended). Add ice and stir. Float the blackstrap rum on top. Serve with a straw.",Alcoholic,Cocktail
74,Citrus Coke,,"2 parts Coca-Cola, 1 part Bacardi Limon, ",Pour half of coke in a glass. Then add Bacardi and top it off with the remaining coke. Stir and drink up!,Alcoholic,Soft Drink
75,Casa Blanca,,"1 1/2 tsp Maraschino liqueur, 1 1/2 tsp Lime juice, 1 1/2 tsp Triple sec, 2 oz Light rum, ","Shake all ingredients with ice, strain into a cocktail glass, and serve.",Alcoholic,Ordinary Drink
76,Clover Club,"IBA,Classic","1 Egg white, Juice of 1/2 Lemon, 2 tsp Grenadine, 1 1/2 oz Gin, ","Dry shake ingredients to emulsify, add ice, shake and served straight up.",Alcoholic,Ordinary Drink
77,Caipirissima,,"crushed Ice, 2-3 oz White rum, 2 tblsp Sugar, 2 Lime, ",Same as Caipirinha but instead of cachaca you add WHITE RUM. It's great!!!!!!!!,Alcoholic,Ordinary Drink
78,City Slicker,,"1 tblsp Lemon juice, 1/2 oz Triple sec, 2 oz Brandy, ","In a shaker half-filled with ice cubes, combine all of the ingredients. Shake well. Strain into a cocktail glass.",Alcoholic,Ordinary Drink
79,Campari Beer,,"1 1/2 cl Campari, 1 bottle Lager, ",Use a 15 oz glass. Add Campari first. Fill with beer.,Alcoholic,Beer
80,Chicago Fizz,,"NoneCarbonated water, 1 Egg white, 1 tsp Powdered sugar, Juice of 1/2 Lemon, 1 oz Port, 1 oz Light rum, ","Shake all ingredients (except carbonated water) with ice and strain into a highball glass over two ice cubes. Fill with carbonated water, stir, and serve.",Alcoholic,Ordinary Drink
81,Cosmopolitan,"IBA,ContemporaryClassic","1/4 cup Cranberry juice, 1/4 oz Cointreau, 1/4 oz Lime juice, 1 1/4 oz Vodka, ",Add all ingredients into cocktail shaker filled with ice. Shake well and double strain into large cocktail glass. Garnish with lime wheel.,Alcoholic,Cocktail
82,Coffee-Vodka,,"NoneCaramel coloring, 1 1/2 cupVodka, 1/2Vanilla, 1/2 cup instant Coffee, 2 cups white Sugar, 2 cups Water, ","Boil water and sugar until dissolved. Turn off heat. Slowly add dry instant coffee and continue stirring. Add a chopped vanilla bean to the vodka, then combine the cooled sugar syrup and coffee solution with the vodka. Cover tightly and shake vigorously each day for 3 weeks. Strain and filter. Its also best to let the sugar mixture cool completely so the vodka won't evaporate when its added. If you like a smoother feel to the liqueur you can add about 1 teaspoon of glycerine to the finished product.",Alcoholic,Homemade Liqueur
83,Casino Royale,,"1 Egg yolk, 1 dash Orange bitters, 1 tsp Maraschino liqueur, 1/2 oz Lemon juice, 2 oz Gin, ","In a shaker half-filled with ice cubes, combine all of the ingredients. Shake well. Strain into a sour glass.",Alcoholic,Ordinary Drink
84,Corpse Reviver,,"1 dashAbsinthe, 3/4 ozLemon Juice, 3/4 ozLillet Blanc, 3/4 ozTriple Sec, 3/4 ozGin, ","Shake, strain, straight up, cocktail glass rinsed with absinthe
",Alcoholic,Cocktail
85,Chocolate Milk,,"1 dash Amaretto, 1/2 shot Milk, 1/2 shot Chocolate liqueur, ","Put the milk in the bottom, pour the Liquer on top and add the dash of amaretto. Do not mix. SLAM IT!",Alcoholic,Shot
86,Clove Cocktail,,"1/2 oz Muscatel Wine, 1/2 oz Sloe gin, 1 oz Sweet Vermouth, ","Stir all ingredients with ice, strain into a cocktail glass, and serve.",Alcoholic,Ordinary Drink
87,Coffee Liqueur,,"2 1/2 cups Water, 1 qt Vodka, 2 1/2 cups Sugar, 4 tblsp Vanilla extract, 10 tblsp instant Coffee, ","Combine coffee, sugar and water. Simmer 1 hour and let cool. Add vanilla and vodka. Age in sealed jar 2 to 3 weeks.",Alcoholic,Homemade Liqueur
88,Coke and Drops,,"7 drops Lemon juice, 1 dl Coca-Cola, ","Take a glass, pour the Coke in the glass, then you take 7 drops of lemon juice. Granish with a lemon slice on the rim of the glass.",Non alcoholic,Soft Drink
89,Chocolate Drink,,"NoneWater, 3/4 L Milk, 125 grChocolate, ","Melt the bar in a small amount of boiling water. Add milk. Cook over low heat, whipping gently (with a whisk, i would assume) until heated well. Don't let it boil! Serve in coffee mug.",Non alcoholic,Cocoa
90,Cranberry Punch,,"2 qt Ginger ale, 1 tblsp Almond flavoring, 4 cups Pineapple juice, 1 1/2 cup Sugar, 4 cups Cranberry juice, ","Combine first four ingredients. Stir until sugar is dissolved, chill. Then add ginger ale just before serving. Add ice ring to keep punch cold.",Non alcoholic,Punch / Party Drink
91,Derby,"Classic,IBA","2 Fresh leavesMint, 2 dashesPeach Bitters, 6 clgin, ",Pour all ingredients into a mixing glass with ice. Stir. Strain into a cocktail glass. Garnish with a sprig of fresh mint in the drink.,Alcoholic,Ordinary Drink
92,Diesel,,"1 dash Blackcurrant cordial, 1/2 pint Cider, 1/2 pint Lager, ",Pour the lager first then add the blackcurrant cordial. Top up with the cider. The colour sholud be very dark approaching the colour of Guiness.,Alcoholic,Beer
93,Daiquiri,"IBA,Classic,Beach","1 tsp Powdered sugar, Juice of 1/2 Lime, 1 1/2 oz Light rum, ",Pour all ingredients into shaker with ice cubes. Shake well. Strain in chilled cocktail glass.,Alcoholic,Ordinary Drink
94,Danbooka,,"1 part Everclear, 3 parts Coffee, ",pour it in and mix it.,Alcoholic,Coffee / Tea
95,Downshift,,"Float Bacardi 151 proof rum, 2 shots Tequila, 1 part Sprite, 2 part Fruit punch, ","Start with the Sprite. Next comes the tequila. After that, add the Minute Maid Fruit Punch, then float the 151. Rocks optional.",Alcoholic,Punch / Party Drink
96,Dragonfly,,"1 Lime, 4 oz Ginger ale, 1 1/2 oz Gin, ","In a highball glass almost filled with ice cubes, combine the gin and ginger ale. Stir well. Garnish with the lime wedge.",Alcoholic,Ordinary Drink
97,Dry Martini,"IBA,Classic,Christmas,Alcoholic","1 Olive, 1/3 oz Dry Vermouth, 1 2/3 oz Gin, ","Straight: Pour all ingredients into mixing glass with ice cubes. Stir well. Strain in chilled martini cocktail glass. Squeeze oil from lemon peel onto the drink, or garnish with olive.",Alcoholic,Cocktail
98,Dry Rob Roy,,"1 twist of Lemon peel, 1 1/2 tsp Dry Vermouth, 2 1/2 oz Scotch, ","In a mixing glass half-filled with ice cubes, combine the Scotch and vermouth. Stir well. Strain into a cocktail glass. Garnish with the lemon twist.",Alcoholic,Ordinary Drink
99,Dirty Nipple,,"NoneBaileys irish cream, NoneSambuca, NoneKahlua, ",This is a layered shot - the Bailey's must be on top,Alcoholic,Shot
100,Dirty Martini,"IBA,NewEra","1Olive, 1 wedgeLemon, 2 tbspOlive Brine, 1 tbspDry Vermouth, 70ml/2fl ozVodka, ","Pour the vodka, dry vermouth and olive brine into a cocktail shaker with a handful of ice and shake well.
Rub the rim of a martini glass with the wedge of lemon.
Strain the contents of the cocktail shaker into the glass and add the olive.
A dirty Martini contains a splash of olive brine or olive juice and is typically garnished with an olive.",Alcoholic,Cocktail
101,Darkwood Sling,,"cubesIce, 1 part Orange juice, 1 part Soda water, 1 part Cherry Heering, ","There are many good cherry liqueurs you can use, but I prefere Heering. Add one share of the liqueur. Then you add one share of Soda. For a sour sling use Tonic (most people prefer the drink without Tonic). Afterwards you fill the glass with Orange Juice and ice cubes.",Alcoholic,Soft Drink
102,Dark and Stormy,"IBA,NewEra","10 clGinger Beer, 5 clDark Rum, ",In a highball glass filled with ice add 6cl dark rum and top with ginger beer. Garnish with lime wedge.,Alcoholic,Ordinary Drink
103,Dark Caipirinha,,"2 1/2 ozCachaca, 1Lime, 2 tsp demerara Sugar, ","Muddle the sugar into the lime wedges in an old-fashioned glass.
Fill the glass with ice cubes.
Pour the cachaca into the glass.
Stir well.",Alcoholic,Cocktail
104,Duchamp's Punch,,"2 sprigsLavender, PinchPepper, 2 DashesAngostura Bitters, 1.5 clSt. Germain, 2.5 clPineapple Syrup, 2.5 clLime Juice, 5 clPisco, ","Shake all ingredients.
Double strain in a chilled double old fashioned glass with abig ice cube.
Garnish with a couple of lavender sprigs",Alcoholic,Cocktail
105,Damned if you do,,"0.25 oz Hot Damn, 0.75 oz Whiskey, ",Pour into shot glass. Put in mouth. Repeat as deemed necessary.,Alcoholic,Shot
106,Dubonnet Cocktail,,"1 twist of Lemon peel, 1 dash Bitters, 3/4 oz Gin, 1 1/2 oz Dubonnet Rouge, ",Stir all ingredients (except lemon peel) with ice and strain into a cocktail glass. Add the twist of lemon peel and serve.,Alcoholic,Ordinary Drink
107,Drinking Chocolate,,"Fresh Whipped cream, 2 oz finely chopped dark Chocolate, 1 Vanilla, 1 stick Cinnamon, 6-8 oz Milk, 2 oz Heavy cream, ","Heat the cream and milk with the cinnamon and vanilla bean very slowly for 15-20 minutes. (If you don't have any beans add 1-2 tsp of vanilla after heating). Remove the bean and cinnamon. Add the chocolate. Mix until fully melted. Serve topped with some very dense fresh whipped cream. Serves 1-2 depending upon how much of a glutton you are. For a richer chocolate, use 4 oz of milk, 4 oz of cream, 4 oz of chocolate. Serve in coffee mug.",Non alcoholic,Cocoa
108,Death in the Afternoon,Drunk,"TopChampagne, 2 shotsAbsinthe, ","Easy as you like, pour the absinthe into a chilled glass, top with champagne. Must be drunk mid afternoon for the optimum effect.",Alcoholic,Cocktail
109,Egg Cream,,"6 oz Soda water, 6 oz whole Milk, 2 tblsp Chocolate syrup, ","Mix syrup and milk in a fountain glass. Add soda water, serve with a straw.",Non alcoholic,Other / Unknown
